"record_id","artist","title","date","medium","discipline","dimensions","funding_source","location","street","city","state","zipcode","lat","lng","description","image_url","detail_url","date_modified"
"2678","Laura Bender, John Early","From Here to There","2007","Birch plywood, MDF board, stone tiles, masonite, sign foam, iron, driftwood, and acrylic paint","sculpture","96 "" x 158 "" x 6 ""","Percent for Art - City of Portland and Housing Authority of Portland","University Park Community Center","9009 N. Foss Street","Portland","OR","97217","45.587653499999988","-122.7107317","From Here to There is a grand metaphor for the venture of exploration. The story is about movement, coordination and change, and references things historical, nautical and navigational. Movement refers to people relocating here, ships sailing rivers and seas, driftwood swept up on the shores of the Columbia River, and people meeting and forming relationships as they dance, exercise and move around one another. There are reminders throughout the artwork of mapping our lives from one stop to the next. under the eternal comings and goings of sun and moon.

We move together and alone but always we move, finding and creating meaning with our hands and hearts.","http://data.racc.org/pa_inventory/1785/1785thumb.jpg","http://racc.org/public-art/search/?recid=2678.137","2012-01-25 00:00:00"

"2688","Linda Wysong","Portals","2007","Concrete","architectural integration","","","River East Center","1515 SE Water Ave","Portland","OR","97214","45.511866699999999","-122.665893","Using slabs of concrete cut from the original Holman Transfer Building, Portals acknowledges the industrial history of the Eastbank and creates continually changing views of the city and the Willamette River.  Concrete is made from the earth...gravel, sand and rock from the river.  The materials embody geology and time while the swale loks to the future.","http://data.racc.org/pa_inventory/1730/1730thumb.jpg","http://racc.org/public-art/search/?recid=2688.101","2009-07-14 00:00:00"

"2752","Cynthia Lahti","Station 15","2005","Clay, acrylic paint, aluminum, and gold leaf","ceramics","each: 15 1/2 "" x 13 "" x 2 ""","Percent for Art - City of Portland","Fire Station 15","1920 SW Spring Street","Portland","OR","97201","45.509180000000001","-122.6987695","A sculptural relief that hangs on the wall was created for this fire station as part of the Intersections Fire Station Residency.  As part of the residency I intensely studied every aspect of the five stations life.  This included going on ride along days to observe their work and the communities they serve.  I also researched the history of firefighting in Portland.  All of these observations combined into ceramic wall pieces that celebrate the life of each fire station.","http://data.racc.org/pa_inventory/1578/1578thumb.jpg","http://racc.org/public-art/search/?recid=2752.153","2011-03-02 00:00:00"

"2753","George Johanson","Great Port City","1992","Ceramic tile on wood","painting","72 "" x 108 "" x 2 "", frame: 72 1/2 "" x 108 1/2 "" x 2 1/4 ""","","Central Library","801 SW 10th Ave","Portland","OR","97205","45.519098","-122.68289900000001","A realist-imaginative portrait of Portland at the end of the 20th Century.","http://data.racc.org/pa_inventory/1786/1786thumb.jpg","http://racc.org/public-art/search/?recid=2753.114","2010-09-20 00:00:00"

"2771","Eric Nez, Aloria Weaver, David  Heskin, Jerod Knapp","Temple of Cosmic Love","2006","Commercial exterior latex on concrete","mural","overall: 20' x 60', area: 1200 square feet","Public Art Mural Program/Private Funding","1000 SE 12th Ave.","1000 SE 12th Ave.","Portland","OR","97214","45.515739000000004","-122.6535475","The mural integrates themes related to the wellness center, healing energy, nature and the elements, and focuses on creating a pleasing landscape that helps transport viewers to a peaceful setting outside the daily hustle and bustle.","http://data.racc.org/pa_inventory/murals/M0006/M0006thumb.jpg","http://racc.org/public-art/search/?recid=2771.123","2011-04-01 00:00:00"

"2773","Mike Leonard-Maguire","Sullivan's Gulch 1806 and Confluences in Time","2006","Acrylic on MDO plywood","mural","overall: 12' x 16', area: 192 square feet","Public Art Mural Program/Private Funding","NE Weidler St. and NE 17th Ave.","NE Weidler St. and NE 17th Ave.","Portland","OR","97232","45.534310099999999","-122.648444","The mural showcases the Sullivan's Gulch neighborhood as it appeared 200 years ago with 47 different native plants and animals.  The mural border depicts Native American petroglyphs along with hobo signs from the 1930s.  The mural is a culminating work for the Grace Academy Confluence Project, Untold Stores, and Unsung Heroes.","http://data.racc.org/pa_inventory/murals/M0007/M0007thumb.jpg","http://racc.org/public-art/search/?recid=2773.124","2012-12-13 00:00:00"

"2774","Shane Bennett, Dan Cohen","Winter Wonderland","2006","Enamel and oil on brick","mural","overall: 37' x 28' 9 "", area: 1064 square feet","Public Art Mural Program/Private Funding","219 SW Broadway","219 SW Broadway","Portland","OR","97205","45.5224428","-122.6781455","A snow boarder is shown leaping off a mountain cliff with a Cascade winter landscape in the background.  The mural is painted with a graphic technique reminiscent of the style found within the snow boarding culture.","http://data.racc.org/pa_inventory/murals/M0008/M0008thumb.jpg","http://racc.org/public-art/search/?recid=2774.125","2011-04-01 00:00:00"

"2775","Sara Stout","Share the Road","2006","Acrylic on concrete","mural","overall: 18' x 36', area: 648 square feet","Public Art Mural Program/Private Funding","4307 SE Hawthorne Blvd.","4307 SE Hawthorne Blvd.","Portland","OR","97215","45.512156500000003","-122.618154","The mural graphically registers the pulse of a neighborhood in motion and integrates the auto into the grander scheme of alternative transportation, environmental sustainability, and the need for harmonious safe traffic through an urban neighborhood.","http://data.racc.org/pa_inventory/murals/M0009/M0009thumb.jpg","http://racc.org/public-art/search/?recid=2775.120","2011-04-01 00:00:00"

"2776","Angelina Marino","Life in the Inner City","2006","Acrylic on concrete","mural","overall: 2' 4 "" x 50' 6 "", area: 1183 square feet","Public Art Mural Program/Private Funding","1131 SE Oak St.","1131 SE Oak St.","Portland","OR","97214","45.520136999999998","-122.654082","This mural depicts a colorful figurative narrative of children at play against underlying abstract images of bridges, cityscapes, and buildings.  The project utilized volunteers from the neighborhood with the goal of enhancing the vibrancy and community atmosphere of the area.","http://data.racc.org/pa_inventory/murals/M0010/M0010thumb.jpg","http://racc.org/public-art/search/?recid=2776.119","2011-01-07 00:00:00"

"2777","Robin Corbo","The Community Cycling Center Mural","2006","Acrylic on concrete","mural","overall: 28' 6 "" x 50' 6 "", area: 1183 square feet","Public Art Mural Program/Private Funding","1700 NE Alberta St.","1700 NE Alberta St.","Portland","OR","97211","45.559003199999999","-122.6476985","The main focus of the mural is a child-powered apparatus, accompanied by a range of locomotion machines for children of all ages and varying physical abilities.  The machines form a parade that includes a tandem bicycle, wheelchair, reclining bicycle, tricycle, unicycle, and other various bicycles.  The imagery in this mural is inspired by the Community Cycling Center's dedication as a non-profit service organization that teaches bicycle safety and provides bicycles to those in need.","http://data.racc.org/pa_inventory/murals/M0011/M0011thumb.jpg","http://racc.org/public-art/search/?recid=2777.126","2012-12-13 00:00:00"

"2778","Hampton Rodriguez","Fusion","2006","Acrylic on wood panel","mural","overall: 15' x 20', area: 300 square feet","Public Art Mural Program/Private Funding","6850 NE Killingsworth St.","6850 NE Killingsworth St.","Portland","OR","97218","45.562168","-122.591927","This mural speaks to universal themes of transformation and identity, with references to Latino culture and cultural transformation experienced by Latino youth in Portland.  The central image is a face divided in two, with two eagle heads rising left and right above the head, representing the dual identities of Latino and US cultures.  The mural involved extensive participation by Latino youth from the neighborhood.","http://data.racc.org/pa_inventory/murals/M0012/M0012thumb.jpg","http://racc.org/public-art/search/?recid=2778.120","2011-01-07 00:00:00"

"2779","Isaka Shamsud-Din, Joe  Cotter, Hector Hernandez, Baba Wague Diakite","The Musician's Union Building Mural","2006","Acrylic on concrete block","mural","overall: 20' x 100', area: 2000 square feet","Public Art Mural Program/Private Funding","325 NE 20th Ave.","325 NE 20th Ave.","Portland","OR","97232","45.525386300000008","-122.64561190000001","This project was designed to bring higher visibility to the artistic community and foster dialogue across boundaries.  Within the mural, images of jazz, European, classical, bluegrass, rock 'n roll, hard rock, hip hop, rhythm and blues, reggae, Asian, Latino, and African influences, provide opportunities for dynamic composition.","http://data.racc.org/pa_inventory/murals/M0013/M0013thumb.jpg","http://racc.org/public-art/search/?recid=2779.123","2011-03-10 00:00:00"

"2780","Dana Lynn Louis","Pranayama","2007","Acrylic on mortar over brick","mural","overall: 6' x 14', area: 84 square feet","Public Art Mural Program/Private Funding","2043 SE 50th Ave.","2043 SE 50th Ave.","Portland","OR","97215","45.508169299999999","-122.6113247","Earth tones and natural shades of red, greens, and blues are used in a diptych portraying a set of abstract yin/yang flower vases reflective of the yoga practiced within the building walls.  Local artists and residents participated in its construction.","http://data.racc.org/pa_inventory/murals/M0014/M0014thumb.jpg","http://racc.org/public-art/search/?recid=2780.117","2011-04-01 00:00:00"

"2781","Heidi Schultz, Matt Bellingham","Hope is Vital","2007","Latex paint on concrete","mural","overall: 12' 6 "" x 26', area: 325 square feet","Public Art Mural Program/Private Funding","1621 NE Grand Ave.","1621 NE Grand Ave.","Portland","OR","97232","45.5345315","-122.6610759","This mural's purpose is to create global solidarity and educate the Portland community about Portland's sister city, Mutare, Zimbabwe, and humanitarian efforts there.  Underneath the inspiring message, ""Hope is Vital,"" the sun shines on a yellow medical clinic Portland helped build for its sister city.  In a show of support, persons from both Portland and Mutare hold hands, dance, and drum to celebrate life, above the text ""it takes a planet to save a village.""","http://data.racc.org/pa_inventory/murals/M0015/M0015thumb.jpg","http://racc.org/public-art/search/?recid=2781.120","2011-01-07 00:00:00"

"2782","24 Artists","The Burnside Rocket","2007","Various acrylic based media on plywood panels","mural","each: 6' x 4', area: 576 square feet","Public Art Mural Program/Private Funding","1111 E Burnside St.","1111 E Burnside St.","Portland","OR","97232","45.522998200000004","-122.6547705","This mural is a collection of 24 - 6' x 4' panels curated by Ruth Ann Brown.  Each of the 24 panels on the building facade collectively represent the historic identity of the Central Eastside Industrial District (CEID) as a place of burgeoning artistic production.  Each artist was chosen for their quality of work, diligence, and ongoing commitment to making art in Portland.","http://data.racc.org/pa_inventory/murals/M0016/M0016thumb.jpg","http://racc.org/public-art/search/?recid=2782.121","2011-01-07 00:00:00"

"2783","Larry Kangas","History of the Horse Through Time and Cultures","2007","Acrylic and latex paint on Pellon adhered to plaster","mural","overall: 7' x 200', area: 1400 square feet","Public Art Mural Program/Private Funding","Parkrose High School","12003 NE Shaver St,","Portland","OR","97220","45.552149999999997","-122.538929","The Parkrose High School mascot, a bronco, is depicted through many cultural traditions.   Students in the school, were engaged in the mural process.","http://data.racc.org/pa_inventory/murals/M0017/M0017thumb.jpg","http://racc.org/public-art/search/?recid=2783.122","2011-01-07 00:00:00"

"2784","Michael T. Hensley","Outside In Dogs (2)","2007","Enamel on panel","mural","overall: 8' x 28', area: 224 square feet","Public Art Mural Program/Private Funding","510 NE Martin Luther King Jr. Blvd.","510 NE Martin Luther King Jr. Blvd.","Portland","OR","97232","45.526653000000003","-122.6616418","This mural focuses on color, composition, and shape, and incorporates dogs and related imagery/themes to the site.","http://data.racc.org/pa_inventory/murals/M0018/M0018thumb.jpg","http://racc.org/public-art/search/?recid=2784.118","2011-01-07 00:00:00"

"2785","Robin Corbo","Women Making History in Portland","2007","Acrylic on concrete block","mural","overall: 18' x 60', area: 1080 square feet","Public Art Mural Program/Private Funding","2335 N Clark Ave.","2335 N Clark Ave.","Portland","OR","97227","45.539937999999999","-122.676827","In Other Words Women's Books and Resources were the organizers of this mural.  The mural represents a women's history of Portland, and was made to promote the mission of empowering women through art and education.  The mural portrays women from all walks of life within the Portland community.","http://data.racc.org/pa_inventory/murals/M0019/M0019thumb.jpg","http://racc.org/public-art/search/?recid=2785.120","2011-01-07 00:00:00"

"2786","William Park","Country United","2007","Acrylic on concrete","mural","","Public Art Mural Program/Private Funding","728 SW 11th Ave.","728 SW 11th Ave.","Portland","OR","97205","45.519861499999998","-122.6833372","This mural portrays diverse persons moving from the isolation of their own existence toward a central fire and gathering place; together in support, strength, and community. The power of the central fire, where many people have gathered and are moving toward, is key.","http://data.racc.org/pa_inventory/murals/M0020/M0020thumb.jpg","http://racc.org/public-art/search/?recid=2786.119","2011-01-07 00:00:00"

"2787","Patrick Greenfield, Jessie Smith, Kenji Lee, Justin White","The Cheerful Tortoise Mural","2007","Belton aerosol spray paint and latex paint on concrete","mural","(1) overall: 4' 6 "" x 7', (2) overall: 5' 1 "" x 7' 7 "", (3) overall: 11' x 47', area: 587 square ","Public Art Mural Program/Private Funding","1935 SW 6th Ave.","1935 SW 6th Ave.","Portland","OR","97201","45.509962999999999","-122.683854","The three mural images depict a variety of Northwest regional sports, united by color, texture and background.  The murals depict portraits of Hall of Fame members from the Northwest, college athletes including Bill Walton and Steve Prefontaine, and the Portland State University mascot and other related university images.","http://data.racc.org/pa_inventory/murals/M0021/M0021thumb.jpg","http://racc.org/public-art/search/?recid=2787.120","2011-01-07 00:00:00"

"2788","Rodolfo Serna, Kate Zonis","The Girls, Inc. Mural","2008","Acrylic and latex paint on panel","mural","overall: 12' x 32'  , area: 384 square feet","Public Art Mural Program/Private Funding","8801 N Lombard St.","8801 N Lombard St.","Portland","OR","97203","45.591142900000001","-122.7558049","Silhouettes of girls are shown holding hands in a circle, dancing around a tree, under a pastel sky. The mural's intention was to reach out to elementary school girls in the St. Johns community, using art and empowerment to critically analyze media messages that influence how girls feel about themselves, and how they treat each other.  The mural represents friendship, growth, community, activity, and empowerment.","http://data.racc.org/pa_inventory/murals/M0022/M0022thumb.jpg","http://racc.org/public-art/search/?recid=2788.121","2011-01-07 00:00:00"

"2814","Lee Kelly","Howard's Way","2007","Stainless steel","sculpture","A: 11' tall, 1300 lbs, B: 9'6 "" tall, 1250 lbs, C: 2' tall, 640 lbs, D: 12' tall, 1050 lbs","Percent for Art - City of Portland and Civic Housing Development Services, LLC","The Civic Apartments","635 Southwest 19th Avenue","Portland","OR","97205","45.522429099999997","-122.69012909999999","Howard's Way is a suite of large sculptures commissioned by the Housing Authority of Portland for their development project in downtown Portland, The Civic/The Morrison.  ""Howard's Way,"" the common plaza joining the two buildings, and the suite of sculptures, is named for Howard Shapiro, former chair of the Housing Authority, and a long-time civic leader and art patron.  Howard's Way was dedicated in October, 2007.","http://data.racc.org/pa_inventory/1787/1787thumb.jpg","http://racc.org/public-art/search/?recid=2814.125","2011-07-14 00:00:00"

"2815","Kenny Scharf","Tikitotemoniki Totems","2001","Painted aluminum","sculpture","each: 30' 1 3/4 "" x 40 "" x 42 ""","Gift/Donation from the Pearl Arts Foundation","Jamison Square","810 NW 11th Avenue","Portland","OR","97209","45.528902000000002","-122.681635","Created by internationally renowned artist Kenny Scharf, the Tikitotemoniki Totems, also known as ""Tiki Totems"", are four 30 foot tall sculptures covering streetcar catenary poles near Jamison Square. Scharf is best known for his adaptation of cartoon images for the realm of fine art and the faces depicted in the totems either delight or unnerve passersby, depending on individual point of view. Scharf remarks, ""These four Tiki Totem monikers are a fantasy come true. To realize something of this magnitude is beyond my wildest dreams. I love the way they relate to the Pacific Northwest culture as well as the universal Tiki culture, which extends from the South Pacific through the Northwest and up to Alaska. As I've said before, art should, above all, be fun, and these huge 3D forms translate that perfectly.""","http://data.racc.org/pa_inventory/1788a-d/1788a-dthumb.jpg","http://racc.org/public-art/search/?recid=2815.134","2011-06-02 00:00:00"

"2821","Donald Fels","Drawing on the River","2008","Steel with music box and historical image viewer elements","sculpture","overall: 6' x 3' x 38'","Percent for Art - Multnomah County","Cathedral Park","N. Pittsburg Ave. and N. Albany St.","Portland","OR","97203","45.586053100000001","-122.7607478","This sculpture was conceived as a tribute to industrial ingenuity in the St. Johns area.   Like the Saint Johns bridge above, it is a suspension structure anchored at each end.  The hull-like end pieces allude to the shipbuilding that went on nearby and were constructed using standard steel shipbuilding techniques by Peninsula Iron Works, a third generation firm adjacent to the park.   ""Drawing on the River"" reflects back on a century of industry in St. Johns and is an homage to both the mills and the workers who ran them.  The piece also invokes the river itself, which powered the mills and is the reason the workers settled here.","http://data.racc.org/pa_inventory/1802/1802thumb.jpg","http://racc.org/public-art/search/?recid=2821.109","2012-11-13 00:00:00"

"2823","Esteban Camacho Steffensen","Vigil of St. Mark","2008","Acrylic on panel","mural","overall: 24' x 16', area: 384 square feet","Public Art Mural Program/Private Funding","9750 SW Terwilliger Blvd.","9750 SW Terwilliger Blvd.","Portland","OR","97219","45.454199299999999","-122.68307249999999","This mural depicts peaceful coexistence with the natural environment and landscape.  A winged mountain lion stands atop a building facade, protecting the food chain as he balances the other species below him with an eye to peace, wholeness, and justice.","http://data.racc.org/pa_inventory/murals/M0026/M0026thumb.jpg","http://racc.org/public-art/search/?recid=2823.124","2011-01-07 00:00:00"

"2824","Hector Hernandez","Flowering Legacy of the Civil Rights Leaders","2008","Acrylic on concrete block","mural","overall: 16' x 57' , area: 912 square feet","Public Art Mural Program/Private Funding","3111 SE 13th Ave.","3111 SE 13th Ave.","Portland","OR","97202","45.500430000000001","-122.652467","The mural project was made by students from the Oregon Leadership Institute at Portland State University.  It features a Portland Rose with petals showing the faces of civil rights leaders Dr. Martin Luther King Jr., Susan B. Anthony, Chief Joseph, Ceasar Chavez, and Mahatma Ghandi.  Other images of freedom are also included in the mural.","http://data.racc.org/pa_inventory/murals/M0025/M0025thumb.jpg","http://racc.org/public-art/search/?recid=2824.118","2011-01-07 00:00:00"

"2825","Anna Garibay","Wilshire Park","2008","Acrylic on concrete block","mural","overall: 10' x 15', area: 150 square feet","Public Art Mural Program/Private Funding","Wilshire Park","NE 33rd Ave. and NE Skidmore St.","Portland","OR","97212","45.554300499999997","-122.6306793","Sited in the Wilshire Park Pavillion, this mural depicts a mother and child in a natural environment reflecting the adjacent play area of the park, as well their relationship with the watershed and adjacent city.","http://data.racc.org/pa_inventory/murals/M0024/M0024thumb.jpg","http://racc.org/public-art/search/?recid=2825.119","2012-12-13 00:00:00"

"2827","Greg Lewis, Larry Gross","Transformation, Integrity, Community","2008","Enamel on marine plywood","mural","overall: 20' x 40', area: 800 square feet","Public Art Mural Program/Private Funding","5949 NE 30th St.","5949 NE 30th St.","Portland","OR","97211","45.566140399999981","-122.6351533","This mural was painted by Concordia University students.  It prominently displays an open book with the words transformation, integrity and community under a flowing tree.  The mural is physically situated where the campus meets the community.","http://data.racc.org/pa_inventory/murals/M0023/M0023thumb.jpg","http://racc.org/public-art/search/?recid=2827.116","2011-01-07 00:00:00"

"2828","John Early, Laura Bender","Tabor Commons","2008","Latex paint","mural","overall: 1100 square feet","Public Art Mural Program/Private Funding","5633 SE Division St.","5633 SE Division St.","Portland","OR","97215","45.505567000000013","-122.605182","The SE Uplift Neighborhood Association mural combines large color fields with imagery relating to gardens and nature in the surrounding community.  Contemporary folk art is referenced through thematic content, asymmetrical shapes, and color arrangements that create a lively sense of rhythm, friendliness, and light.","http://data.racc.org/pa_inventory/murals/M0027/M0027thumb.jpg","http://racc.org/public-art/search/?recid=2828.124","2011-03-16 00:00:00"

"2829","Angelina Marino, Gary Herd, Marlys Mick, Joel Heidel","A Neighborhood in Motion","2008","Acrylic","mural","overall: 12' x 60', area: 720 square feet","Public Art Mural Program/Private Funding","7215 NE Sandy Blvd.","7215 NE Sandy Blvd.","Portland","OR","97213","45.548507600000001","-122.5885145","This mural reflects the surrounding community, brought together by the mural process.  A winding road with trucks and cars, a barbershop, grocers, soda jerk, war time workers, and unicyclist are among the many neighborhood images shown.","http://data.racc.org/pa_inventory/murals/M0028/M0028thumb.jpg","http://racc.org/public-art/search/?recid=2829.114","2011-01-07 00:00:00"

"2835","Debra Beers","Juvenile Justice Center Portraits Project","2008","Charcoal and soft pastel on paper","drawing","image: 38 "" x 50 "", frame: 41 1/2 "" x 53 1/2 "" x 2 ""","Percent for Art - Multnomah County","Multnomah County Juvenile Justice Center","1401 NE 68th Ave","Portland","OR","97213","45.5316951","-122.59439","These drawings were created with the intent of honoring the uniqueness of the two young people portrayed.  After a series of meetings with the subjects and the GOALS Program coordinators, their interests, dreams and reflections came to life in the portraits.","http://data.racc.org/pa_inventory/1804/1804thumb.jpg","http://racc.org/public-art/search/?recid=2835.96","2010-08-31 00:00:00"

"2851","Rhiza A + D","BIG PIPE PORTAL: Making the Invisible Visible","2009","Reinforced concrete, galvanized steel, and stainless steel","sculpture","overall: 18' 4 "" x 21' 10 "" x 22' 10 ""","Percent for Art - City of Portland","4299 N Port Center Way","4299 N Port Center Way","Portland","OR","97217","45.554309600000003","-122.6972006","This sculpture is sited on the banks of the Willamette River at the confluence of the East Side and West Side Combined Sewer Overflow (C.S.O.) tunnels, and is surrounded by a man-made home to heavy industry. The sculpture echoes an ecological approach to the built environment wherein manufacturing is interwoven with our shared natural resources.

Although the Big Pipe Project is the largest infrastructure project in Portland history, it is largely invisible.  Working closely with the Bureau of Environmental Services, the sculpture celebrates this hidden work by revealing and readapting massive precast concrete segments of the Big Pipe.  These pieces of infrastructure are now put to work in support of art and narrative.  Partially buried in the alluvial bank, the sculpture traces out the circumference of the hidden pipe and transforms it from an industrial artifact into a woven arch of currents and eddies.","http://data.racc.org/pa_inventory/1805/1805thumb.jpg","http://racc.org/public-art/search/?recid=2851.82","2011-08-19 00:00:00"

