"record_id","artist","title","date","medium","discipline","dimensions","funding_source","location","street","city","state","zipcode","lat","lng","description","image_url","detail_url","date_modified"
"1553","Ed Carpenter, John Rogers","Sound Abatement Sculpture","1997","Aluminum, stainless steel, and dichroic glass","architectural integration","38' x 12'","Multnomah County Funds","Juvenile Justice Center","1401 NE 68th Ave","Portland","OR","97213","45.5316951","-122.59439","This piece is a collaboration between Ed Carpenter and John Rogers. Both artists live and work in Portland, OR, and specialize in large-scale public installations both nationally and internationally. Ed Carpenter's work ranges from architectural sculpture to infrastructure design and John Rogers is known for his light-kinetic sculptures that can be found across the US.","http://data.racc.org/pa_inventory/1191/1191thumb.jpg","http://racc.org/public-art/search/?recid=1553.146","2011-08-23 00:00:00"

"1566","Garth Edwards","East Portland Community Center: Tower","1998","Aluminum","sculpture","variable dimensions","Percent for Art - City of Portland","East Portland Community Center","740 SE 106th Ave.","Portland","OR","97216","45.516030999999998","-122.55296800000001","A variety of metal cut designs compose the artworks created for the East Portland Community Center by Garth Edwards.  The forms were incorporated into the central tower of the building, benches in several public areas, fences surrounding the courtyard, and bike racks at the entrance to the building.  The artist developed his ideas through conversations with Parks employees, who suggested that nature-inspired themes would be appropriate for this site.  Garth had long been experimenting with ideas of  foliage images, especially with the variety of leaf designs that are possible. The Community Center project allowed him to bring his thinking into reality.  The designs complement the architecture and soften some of the building's hard surfaces.   He hopes his decorative metal designs will seem whimsical and fun to community center visitors.","http://data.racc.org/pa_inventory/1202.1/1202.1thumb.jpg","http://racc.org/public-art/search/?recid=1566.179","2012-03-05 00:00:00"

"1567","Garth Edwards","East Portland Community Center: Bike Racks","1998","Welded mild steel","sculpture","variable dimensions","Percent for Art - City of Portland","East Portland Community Center","740 SE 106th Ave.","Portland","OR","97216","45.516030999999998","-122.55296800000001","A variety of metal cut designs compose the artworks created for the East Portland Community Center by Garth Edwards.  The forms were incorporated into the central tower of the building, benches in several public areas, fences surrounding the courtyard, and bike racks at the entrance to the building.  The artist developed his ideas through conversations with Parks employees, who suggested that nature-inspired themes would be appropriate for this site.  Garth had long been experimenting with ideas of  foliage images, especially with the variety of leaf designs that are possible. The Community Center project allowed him to bring his thinking into reality.  The designs complement the architecture and soften some of the building's hard surfaces.   He hopes his decorative metal designs will seem whimsical and fun to community center visitors.","http://data.racc.org/pa_inventory/1202.2/1202.2thumb.jpg","http://racc.org/public-art/search/?recid=1567.173","2012-03-05 00:00:00"

"1568","Garth Edwards","East Portland Community Center Benches","1998","Aluminum and cedar","sculpture","variable dimensions","Percent for Art - City of Portland","East Portland Community Center","740 SE 106th Ave.","Portland","OR","97216","45.516030999999998","-122.55296800000001","A variety of metal cut designs compose the artworks created for the East Portland Community Center by Garth Edwards.  The forms were incorporated into the central tower of the building, benches in several public areas, fences surrounding the courtyard, and bike racks at the entrance to the building.  The artist developed his ideas through conversations with Parks employees, who suggested that nature-inspired themes would be appropriate for this site.  Garth had long been experimenting with ideas of  foliage images, especially with the variety of leaf designs that are possible. The Community Center project allowed him to bring his thinking into reality.  The designs complement the architecture and soften some of the building's hard surfaces.   He hopes his decorative metal designs will seem whimsical and fun to community center visitors.","http://data.racc.org/pa_inventory/1202.3/1202.3thumb.jpg","http://racc.org/public-art/search/?recid=1568.173","2012-03-05 00:00:00"

"1569","Garth Edwards","East Portland Community Center: Fences","1998","Aluminum","sculpture","variable dimensions","Percent for Art - City of Portland","East Portland Community Center","740 SE 106th Ave.","Portland","OR","97216","45.516030999999998","-122.55296800000001","A variety of metal cut designs compose the artworks created for the East Portland Community Center by Garth Edwards.  The forms were incorporated into the central tower of the building, benches in several public areas, fences surrounding the courtyard, and bike racks at the entrance to the building.  The artist developed his ideas through conversations with Parks employees, who suggested that nature-inspired themes would be appropriate for this site.  Garth had long been experimenting with ideas of  foliage images, especially with the variety of leaf designs that are possible. The Community Center project allowed him to bring his thinking into reality.  The designs complement the architecture and soften some of the building's hard surfaces.   He hopes his decorative metal designs will seem whimsical and fun to community center visitors.","http://data.racc.org/pa_inventory/1202.4/1202.4thumb.jpg","http://racc.org/public-art/search/?recid=1569.172","2012-03-05 00:00:00"

"1570","Lucinda Parker","Rose City, City Rose","1998","Acrylic on canvas and wood","painting","48 "" x 36 ""","Percent for Art - City of Portland","City Hall","1221 SW 4th Avenue","Portland","OR","97204","45.514906500000002","-122.67868730000001","These pieces depict two versions of a rose, which the artist describes as, ""the classic concentric spiraling form which challenges the painter to see it fresh:  not a copy from nature, which already does it better, but a reinvention based on a collision between geometry and gesture.","http://data.racc.org/pa_inventory/1203/1203thumb.jpg","http://racc.org/public-art/search/?recid=1570.162","2011-05-03 00:00:00"

"1572","Jack McLarty","A Portland Story","1998","Hand-colored woodblock","printmaking","8' x 15'","Percent for Art - City of Portland","City Hall","1221 SW 4th Avenue","Portland","OR","97204","45.514900900000001","-122.6786639","Jack McLarty, a lifelong Portlander, grew up within three blocks of Portland's City Hall and attended the Museum Art School (now the Pacific Northwest College of Art), where he later taught.  Since early in his career, when he decided to do what he knew best, his paintings have included Portland imagery.

A large mural of colored woodcut panels entitled A Portland Story was installed on the third floor of City Hall as part of the City's Percent for Art program.  McLarty sees the Willamette River as the heart of the City and made it the central focus of the piece.  The side panels represent incidents, people, and buildings important throughout Portland's history.","http://data.racc.org/pa_inventory/1204/1204thumb.jpg","http://racc.org/public-art/search/?recid=1572.216","2012-03-05 00:00:00"

"1573","Michael Brophy","Lower Willamette Arch: River and Forest","1998","Acrylic on canvas","painting","radius: 95 "", base: 192 ""","Percent for Art - City of Portland","City Hall","1221 SW 4th Avenue","Portland","OR","97204","45.514906500000002","-122.67868730000001","""Portland is a city founded on a river in the middle of a forest and my intent is to depict the sweep of the river valley with a nod towards its history.  Stretching from the lower left across the canvas, up river, the 20th, 19th and pre-settlement centuries are presented.  The foreground trees are Douglas firs, the state tree, and rise like columns supporting the region, and defining its character and prosperity.""","http://data.racc.org/pa_inventory/1205/1205thumb.jpg","http://racc.org/public-art/search/?recid=1573.141","2011-05-03 00:00:00"

"1574","Don Merkt","Our Time","1998","Bronze, glass, fluorescent lighting, and welded steel","sculpture","5' x 3' x 1' 2 ""","Percent for Art - City of Portland","City Hall","1221 SW 4th Avenue","Portland","OR","97204","45.514906500000002","-122.67868730000001","""Ironically, this is a timeless piece; which honors the citizens of Portland who occupy (have occupied, will occupy) this council chamber with their time and vision, in order to build a better Portland and enrich 'our time'.""","http://data.racc.org/pa_inventory/1206/1206thumb.jpg","http://racc.org/public-art/search/?recid=1574.161","2011-05-03 00:00:00"

"1575","Don Merkt","Port/Land","1998","Reinforced plaster","sculpture","","Percent for Art - City of Portland","City Hall","1221 SW 4th Avenue","Portland","OR","97204","45.514906500000002","-122.67868730000001","""This diptych paraphrases the name ""Portland"" by illustrating our city's topography as a place defined by the interaction of it's natural resources, water and land.""","http://data.racc.org/pa_inventory/1207/1207thumb.jpg","http://racc.org/public-art/search/?recid=1575.153","2011-05-03 00:00:00"

"1576","Norie Sato, Tad Savinar, Bill Will","Brief Cases","1998","Bronze, stainless steel, and plaster","sculpture","8' x 25'","Percent for Art - City of Portland","City Hall","1221 SW 4th Avenue","Portland","OR","97204","45.514906500000002","-122.67868730000001","""The formalities of city government are often seen in contrast to the idiosyncrasies of the individual lives that make up its population.  Brief Cases offers a view of the interweaving of the personal and the civic that is the core of a city's character.""","http://data.racc.org/pa_inventory/1208/1208thumb.jpg","http://racc.org/public-art/search/?recid=1576.182","2011-05-03 00:00:00"

"1577","Jim Blashfield, Carol Sherman","Evolution of a City","1998","Computer, monitor and other electronic media, steel and glass","mixed media","","Percent for Art - City of Portland","City Hall","1221 SW 4th Avenue","Portland","OR","97204","45.514906500000002","-122.67868730000001","Evolution of a City  is a way to present Portland's past to itself by unearthing and exhibiting, in an interesting and unusual way, a vast collection of historical still photographs taken over the past hundred years in various parts of the city.","http://data.racc.org/pa_inventory/1209/1209thumb.jpg","http://racc.org/public-art/search/?recid=1577.160","2011-05-03 00:00:00"

"1578","Douglas Senft","Awning","1976","Painted aluminum","sculpture","width: 60'","Portland Development Commission","SW 3rd Ave. and SW Market St.","SW 3rd Ave. and SW Market St.","Portland","OR","97201","45.512272199999998","-122.6788148","""Awning,"" by artist Douglas Senft, was selected by the Portland Development Commission from over 200 proposals in a call for art designed to ""humanize"" the modern architecture of the Portland Center. Senft was only 26 at the time of the work's installation. He is from Burnaby, B.C. and has had numerous public commissions in Canada, the United States and Europe.","http://data.racc.org/pa_inventory/0654/0654thumb.jpg","http://racc.org/public-art/search/?recid=1578.193","2012-02-28 00:00:00"

"1583","Bill Will","Eleven Very Small Sculptures","1998","Bronze","sculpture","variable dimensions, life size","Percent for Art - City of Portland","Wallace Park","2550 NW Raleigh St.","Portland","OR","97210","45.533962699999996","-122.703802","A curious collection of eleven life-size bronze sculptures of common objects can be found tucked away in unexpected places throughout the park. The artist's goal for this piece was to provide artwork that would be subtle and integral to the environment, but would not compete with or obscure the elements that have already made the park an urban oasis.","http://data.racc.org/pa_inventory/1214a-k/1214a-kthumb.jpg","http://racc.org/public-art/search/?recid=1583.184","2011-04-25 00:00:00"

"1585","John Early","Ten Portraits","1998","Silkscreen on porcelain enamel","printmaking","image: 20' x 8'
(22 "" x 24 "" each panel)","Percent for Art - Multnomah County","Northeast Health Clinic","5329 NE Martin Luther King Jr. Blvd","Portland","OR","97211","45.561677099999997","-122.6615406","This work is based on pencil sketches of Northeast Health Center clients, made in 1996.  The portraits are meant to represent a cross section of people who use the center.","http://data.racc.org/pa_inventory/1216/1216thumb.jpg","http://racc.org/public-art/search/?recid=1585.123","2010-08-31 00:00:00"

"1586","Adriene Cruz, Jamaan Profit, Jose Reyes","NE Health Center Building Exterior","1998","Latex paint","painting","","Percent for Art - Multnomah County","Northeast Health Clinic","5329 NE Martin Luther King Jr. Blvd","Portland","OR","97211","45.561676400000003","-122.6615264","Nationally known quilt maker, Adriene Cruz, was selected for this Percent for Art project which partially funded the enhancement of the building's exterior.  The artist believes that colors have a magical way of transforming space and the right combination will positively impact the community.  She used colors and patterns found in her quilts, as well as African Adinkra symbols as design elements in selected areas around the building's perimeter.  The symbols represent ideas that are universal:  learning from the past, unity, adaptability, faith, and the panorama of creation.  An explanation of the symbols can be found on the north side of the building.  Assisting Adriene with the project were Calvert Johnny and two youth from the community, Jamaan Profit and Jose Reyes.","http://data.racc.org/pa_inventory/1217/1217thumb.jpg","http://racc.org/public-art/search/?recid=1586.140","2012-03-05 00:00:00"

"1587","George Johanson","Ocean","1998","Italian porcelain tiles","ceramics","4' x 20' (48 "" x 229 "")","Percent for Art - City of Portland","Peninsula Park Community Center","700 N Rosa Parks Way","portland","OR","97217","45.569913","-122.6738174","Swimmers and bathers have long been subjects in George Johanson's artwork. He designed these figures in the hope that  the murals would interact with people in the real pool, and keep them company.","http://data.racc.org/pa_inventory/1218.1/1218.1thumb.jpg","http://racc.org/public-art/search/?recid=1587.156","2011-08-25 00:00:00"

"1588","George Johanson","Pool","1998","Italian porcelain tiles","ceramics","4' x 20' (48 "" x 233 "")","Percent for Art - City of Portland","Peninsula Park Community Center","700 N Rosa Parks Way","portland","OR","97217","45.569913","-122.6738174","Swimmers and bathers have long been subjects in George Johanson's artwork. He desinged these figures in the hope that  the murals would interact with people in the real pool, and keep them company.","http://data.racc.org/pa_inventory/1218.2/1218.2thumb.jpg","http://racc.org/public-art/search/?recid=1588.154","2011-08-18 00:00:00"

"1658","Ellen Sollod","Untitled (Pier Park Spray Pool)","1998","Porcelain tile with epoxy resin","ceramics","diameter: 36' (approximate)","Percent for Art - City of Portland","Pier Park","N Bruce Ave","Portland","OR","97203","45.602384600000001","-122.7601817","The Pier Park Pool is inspired by ancient Roman floor mosaics which served both educational purposes and as signposts. The plants and animals depicted can bed found in the restored Ramsey Lake Wetland.","http://data.racc.org/pa_inventory/1251/1251thumb.jpg","http://racc.org/public-art/search/?recid=1658.148","2012-03-05 00:00:00"

"1669","Carolyn King","Taking Measure","1998","Stainless steel, stone, soil, silicon bronze, and concrete","sculpture","","Percent for Art - Multnomah County","Yeon Building
1620 SE 190th","1620 SE 190th Ave.","Portland","OR","97233","45.510278","-122.4679462","This piece reflects on how we measure the surface and volume of land and how that has changed through time.","http://data.racc.org/pa_inventory/1257/1257thumb.jpg","http://racc.org/public-art/search/?recid=1669.152","2011-07-13 00:00:00"

"1670","Mathieu Gregoire","River Shift","1999","Basalt, concrete, and steel","sculpture","250' x 60' (approximate)","Percent for Art - City of Portland","South Waterfront Park","SW Montgomery St. and SW River Dr.","Portland","OR","97201","45.509665800000001","-122.6748662","The idea for this piece had its source in the rough concrete piers and reinforcements that were being excavated from the old waterfront site when I first saw it.  I made a progression using local basalt stone and the existing wrecked concrete.

At the top of the berm there is a grouping of saw-cut vertical basalt, and some irregular, displaced foundations.  As the basalt pieces progress from berm to river, they tip over, so that the concrete below becomes exposed and the basalt becomes submerged and eventually disappears.

At the river path there are various configurations of concrete and stone, including inlays and pieces that can function as seating.  Concrete is cut in various places to expose the river rock aggregate inside as well as the old embedded wood piers, and some heavy steel reinforcement emerges in various plant-like and root-like ways.

The work is meant to be a quiet narrative that is derived and retained from the site, rather than a thing that was brought in.","http://data.racc.org/pa_inventory/1259/1259thumb.jpg","http://racc.org/public-art/search/?recid=1670.170","2012-03-05 00:00:00"

"1674","Juan Alonso","Diva","1999","Acrylic on wood","painting","47 1/2 "" x 120 1/2 ""","Percent for Art - City of Portland","1900 Building","1900 SW 4th Ave","Portland","OR","97201","45.509748100000003","-122.6810495","""The work I have been creating since 1995, has focused on a floral/plant theme.  Because of the purpose of the building and the art committee's desire to counterpoint the City's complex regulatory processes, bringing a bit of nature inside might ease the stress that undoubtedly some clients, as well as employees in the building, may face on a daily basis.""

Special thanks to Gerding Edlen for the generous donation which made this work possible.","http://data.racc.org/pa_inventory/1261/1261thumb.jpg","http://racc.org/public-art/search/?recid=1674.141","2010-09-20 00:00:00"

"1675","Robert Yoder","Sweet Air Bend","1999","Oil and acrylic on wood","painting","","Percent for Art - City of Portland","1900 Building","1900 SW 4th Ave","Portland","OR","97201","45.509753000000003","-122.6810667","Artist Robert Yoder manipulates found wood, graphite, paint and wax to transform discarded detritus of urban life into objects of uncommon beauty.  Sweet Air Bend is composed of four individual 24"" x 26"" panels hung together in a horizontal line.

""This work is about the American landscape, most notably, the roadside signs, which dot the streets and are meant to be seen at a certain rate of speed.

When we slow down, they no longer make sense; their ability to communicate is dependent upon our quick glance.  These collages are all made from cut and reassembled signs.  They seem recognizable at first, yet lose all information upon viewing.  I am interested in the new communication that is formed in their familiar but unreadable symbols. 

Composition and craftsmanship are two characteristics in artwork that I admire.  I feel that my education, first as a jeweler and later as a fiber artist, not only taught me the respect necessary for this current method of working, but was also instrumental in directing my aesthetic decisions.""","http://data.racc.org/pa_inventory/1262a/1262athumb.jpg","http://racc.org/public-art/search/?recid=1675.164","2012-03-05 00:00:00"

"1679","James Thompson","The Artist","1999","Acrylic on paper","painting","18 "" x 22 ""","Percent for Art - City of Portland","1900 Building","1900 SW 4th Ave","Portland","OR","97201","45.509748100000003","-122.6810495","""I use images, or fragments of images, from medieval art.  I became interested in medieval art (European) by looking at hundreds of illuminated manuscripts while on a trip to England, Scotland and Ireland in 1995.  I find the art very real, unlike renaissance art, which I see as highly abstract models of painting and geometry.  The seven paintings in this series are about people who use their hands and bodies to work and complete tasks.""","http://data.racc.org/pa_inventory/1263.1/1263.1thumb.jpg","http://racc.org/public-art/search/?recid=1679.153","2011-09-19 00:00:00"

"1680","James Thompson","Butchers","1999","Acrylic on paper","painting","18 "" x 22 ""","Percent for Art - City of Portland","1900 Building","1900 SW 4th Ave","Portland","OR","97201","45.509748100000003","-122.6810495","""I use images, or fragments of images, from medieval art.  I became interested in medieval art (European) by looking at hundreds of illuminated manuscripts while on a trip to England, Scotland and Ireland in 1995.  I find the art very real, unlike renaissance art, which I see as highly abstract models of painting and geometry.  The seven paintings in this series are about people who use their hands and bodies to work and complete tasks.""","http://data.racc.org/pa_inventory/1263.2/1263.2thumb.jpg","http://racc.org/public-art/search/?recid=1680.159","2011-09-19 00:00:00"

"1681","James Thompson","Woodworker","1999","Acrylic on paper","painting","18 "" x 22 ""","Percent for Art - City of Portland","1900 Building","1900 SW 4th Ave","Portland","OR","97201","45.509748100000003","-122.6810495","""I use images, or fragments of images, from medieval art.  I became interested in medieval art (European) by looking at hundreds of illuminated manuscripts while on a trip to England, Scotland and Ireland in 1995.  I find the art very real, unlike renaissance art, which I see as highly abstract models of painting and geometry.  The seven paintings in this series are about people who use their hands and bodies to work and complete tasks.""","http://data.racc.org/pa_inventory/1263.3/1263.3thumb.jpg","http://racc.org/public-art/search/?recid=1681.166","2011-09-19 00:00:00"

"1682","James Thompson","The Farmer","1999","Acrylic on paper","painting","18 "" x 22 ""","Percent for Art - City of Portland","1900 Building","1900 SW 4th Ave","Portland","OR","97201","45.509748100000003","-122.6810495","""I use images, or fragments of images, from medieval art.  I became interested in medieval art (European) by looking at hundreds of illuminated manuscripts while on a trip to England, Scotland and Ireland in 1995.  I find the art very real, unlike renaissance art, which I see as highly abstract models of painting and geometry.  The seven paintings in this series are about people who use their hands and bodies to work and complete tasks.""","http://data.racc.org/pa_inventory/1263.4/1263.4thumb.jpg","http://racc.org/public-art/search/?recid=1682.149","2011-09-19 00:00:00"

"1683","James Thompson","Weavers","1999","Acrylic on paper","painting","18 "" x 22 ""","Percent for Art - City of Portland","1900 Building","1900 SW 4th Ave","Portland","OR","97201","45.509748100000003","-122.6810495","""I use images, or fragments of images, from medieval art.  I became interested in medieval art (European) by looking at hundreds of illuminated manuscripts while on a trip to England, Scotland and Ireland in 1995.  I find the art very real, unlike renaissance art, which I see as highly abstract models of painting and geometry.  The seven paintings in this series are about people who use their hands and bodies to work and complete tasks.""","http://data.racc.org/pa_inventory/1263.5/1263.5thumb.jpg","http://racc.org/public-art/search/?recid=1683.156","2011-09-19 00:00:00"

"1684","James Thompson","Stonecutters","1999","Acrylic on paper","painting","18 "" x 22 ""","Percent for Art - City of Portland","1900 Building","1900 SW 4th Ave","Portland","OR","97201","45.509748100000003","-122.6810495","""I use images, or fragments of images, from medieval art.  I became interested in medieval art (European) by looking at hundreds of illuminated manuscripts while on a trip to England, Scotland and Ireland in 1995.  I find the art very real, unlike renaissance art, which I see as highly abstract models of painting and geometry.  The seven paintings in this series are about people who use their hands and bodies to work and complete tasks.""","http://data.racc.org/pa_inventory/1263.6/1263.6thumb.jpg","http://racc.org/public-art/search/?recid=1684.151","2011-09-19 00:00:00"

"1685","James Thompson","The Ploughman","1999","Acrylic on paper","painting","18 "" x 22 ""","Percent for Art - City of Portland","1900 Building","1900 SW 4th Ave","Portland","OR","97201","45.509748100000003","-122.6810495","""I use images, or fragments of images, from medieval art.  I became interested in medieval art (European) by looking at hundreds of illuminated manuscripts while on a trip to England, Scotland and Ireland in 1995.  I find the art very real, unlike renaissance art, which I see as highly abstract models of painting and geometry.  The seven paintings in this series are about people who use their hands and bodies to work and complete tasks.""","http://data.racc.org/pa_inventory/1263.7/1263.7thumb.jpg","http://racc.org/public-art/search/?recid=1685.149","2011-09-19 00:00:00"

